date_of_report,report_title,overall_theme_tags,scam_category,blockchain,blockchain_id,technology_used,report_description,report_related_links,report_related_image_link,report_url,report_extraction_timestamp
2026-06-10,Secret bridge exploited for $4.67 million a week before anyone notices,Hack or scam,Bridge Exploit,Cosmos,[],,"The bridge between the Cosmos-based Secret network and Axelar network was exploited via an infinite mint bug that went unnoticed for a week. An attacker exploited a smart contract in order to mint a large quantity of wrapped Axelar tokens on the Secret network, which they then redeeemed for around $4.67 million. The exploit, which occurred on June 10, went unnoticed until June 17, when a transaction failed with a message suggesting that more tokens had been bridged out of the Secret network than had been bridged in. Secret has warned, ""If you hold Axelar-bridged saXXX tokens on Secret, please be aware their backing was affected and your funds may be lost.""","[""https://cointelegraph.com/news/secret-network-bridge-exploited-infinite-mint-bug"", ""https://web.archive.org/web/20260622145138/https://cointelegraph.com/news/secret-network-bridge-exploited-infinite-mint-bug""]",https://primary-cdn.web3isgoinggreat.com/entryImages/logos/resized/secret_300.webp,https://www.web3isgoinggreat.com/?id=secret-bridge-exploit,2026-07-22 20:31:55
2026-05-30,Gravity Bridge drained of $5.4 million,Hack or scam,Bridge Exploit,"Cosmos, Ethereum",[1],,"Gravity Bridge, a bridge between the Cosmos and Ethereum blockchains, suffered $5.4 million in losses likely due compromised private keys. The developers of the protocol urged validators to halt while the theft was investigated, and the bridge was indeed halted shortly after. Two weeks after the hack, the Gravity Bridge interface remained unavailable.","[""https://x.com/SpecterAnalyst/status/2060613063816941820?s=20"", ""https://x.com/gravity_bridge/status/2060737691348807698""]",https://primary-cdn.web3isgoinggreat.com/entryImages/logos/resized/gravity-bridge_300.webp,https://www.web3isgoinggreat.com/?id=gravity-bridge-theft,2026-07-22 20:31:55
2024-10-15,Cosmos founder reveals a portion of the protocol was created by North Korean developers,Shady business,,Cosmos,[],,"Cosmos creator Jae Kwon has raised concerns about a portion of the Cosmos protocol called the ""Liquid Staking Module"" after learning it was developed by North Korean agents. Although a contributor to the protocol, Zaki Manian, learned of the developers' links to North Korea after contact from the FBI in March 2023, Kwon claims that Manian ignored known flaws in their code, failed to fully audit their code, and did not report the issue to the project team or the Cosmos community. According to Kwon, the code contained a vulnerability that would allow stakers to avoid having their stakes slashed, which ""contradicts the fundamental principles of staking security."" Kwon urged the Cosmos governance team to perform a full audit of the code written by these developers, and develop more protocols to prevent issues like this going forward. He also called for the governance team to blacklist Zaki Manian.","[""https://twitter.com/web3isgreat/status/1848776980780454383"", ""https://github.com/allinbits/announcements/blob/main/2024_10_15_lsmnk.md""]",https://primary-cdn.web3isgoinggreat.com/entryImages/logos/resized/cosmos_300.webp,https://www.web3isgoinggreat.com/?id=cosmos-lsm,2026-07-22 20:31:55
2024-08-01,Kujira token tanks as team's leveraged bets melt down,Bummer,,Cosmos,[],DeFi,"The team behind the Kujira project wound up with around $2 million in bad debt after taking some of their operational funds and using it to make leveraged bets on their own platform. They blamed ""a series of events over the last few months, including exploits, socially engineered attacks and fallouts within the ecosystem"" for causing the positions to be liquidated. The $KUJI token price crashed by more than 60% as a result of the team's poor risk management. The Kujira team apologized for the fiasco, and announced a plan to create a DAO to take over the project treasury.","[""https://twitter.com/web3isgreat/status/1820116140145737841"", ""https://www.coindesk.com/markets/2024/08/02/kujira-foundations-tokens-stung-by-its-own-leveraged-positions-as-bets-backfire/"", ""https://web.archive.org/web/20240804022039/https://www.coindesk.com/markets/2024/08/02/kujira-foundations-tokens-stung-by-its-own-leveraged-positions-as-bets-backfire/"", ""https://x.com/TeamKujira/status/1819013564906053829""]",https://primary-cdn.web3isgoinggreat.com/entryImages/logos/resized/kujira_300.webp,https://www.web3isgoinggreat.com/?id=kujira-token-tanks-as-teams-leveraged-bets-melt-down,2026-07-22 20:31:55
2024-06-05,"Blockchain developer loses over $48,000 after posting private key to Github","Bad idea, Bummer, Hack or scam",Hack,Cosmos,[],,"A blockchain developer posted on Twitter that he had lost almost $50,000 after his cryptocurrency wallet was drained. He explained that he had been working on a software project on Github in a private repository that contained his wallet's private key . In order to apply for a funding grant from the Optimism project, he had to make the repository public. However, he forgot that the secret key was in the repository. Generally, it is very bad practice to store sensitive secrets in Github, even when projects are set to private. ""Got drained of everything,"" he wrote on Twitter. A commenter asked how long it took for the attacker to steal the money after the private key became publicly visible. ""2 min"", he replied.","[""https://x.com/bdguan/status/1798414648884052147""]",,https://www.web3isgoinggreat.com/?id=br1aneth-private-key-compromise,2026-07-22 20:31:55
2023-12-26,Levana Protocol loses over $1.1 million in slow motion,Hack or scam,Hack,Cosmos,[],DeFi,"An attacker successfully manipulated an oracle to drain around 10% of the liquidity pool for the Levana Protocol, an Osmosis-based perpetual futures project. This amounted to $1.146 million. The attack was unusual in that it lasted almost two weeks, going unnoticed because it was draining pools slowly enough that the Levana team assumed it was organic activity. However, when the network became congested, the attack suddenly became more profitable — and more noticeable.","[""https://twitter.com/web3isgreat/status/1741154438062936481"", ""https://blog.levana.finance/levana-exploit-postmortem-df89a72cc92b"", ""https://web.archive.org/web/20231230174753/https://blog.levana.finance/levana-exploit-postmortem-df89a72cc92b?gi=72b26b6ffe57""]",https://primary-cdn.web3isgoinggreat.com/entryImages/logos/resized/levana_300.webp,https://www.web3isgoinggreat.com/?id=levana-protocol-exploit,2026-07-22 20:31:55
2023-06-05,SEC files complaint against Binance,Law,,"BNB Chain, Cardano, Cosmos, Polygon, Solana","[56, 137]",,"The SEC has filed a complaint against Binance, various related companies, and Binance CEO Changpeng ""CZ"" Zhao. They allege that the company has been acting with ""blatant disregard"" of US securities laws through their operation of unregistered trading platforms, have performed multiple offers of unregistered securities and investment schemes, and have defrauded investors through material misstatements around supposed controls for manipulative trading activity, such as wash trading , on the Binance platforms. The complaint echoes some of the allegations made by the CFTC in a March lawsuit , including that Binance.US was primarily a front for Binance's international platform that was used to try to distract US regulators. However, it also goes farther by adding allegations around Binance's lack of controls around market manipulation, which the SEC alleges contradict public statements by Binance that they had sophisticated programs to prevent wash trading and other manipulative actions. The SEC even claims that the CZ-owned and -operated market maker Sigma Chain was engaged in substantial wash trading on the platform. The SEC lawsuit was also a bit of a bombshell in its naming of some major cryptocurrencies as securities: SOL, ADA, MATIC, FIL, ATOM, SAND, MANA, ALGO, AXS, and COTI. These are the crypto assets associated, respectively, with the Solana, Cardano, Polygon, Filecoin, [d] Cosmos, The Sandbox , Decentraland , Algorand, Axie Infinity , and Coti projects.","[""https://twitter.com/web3isgreat/status/1665799853677375491"", ""https://www.mollywhite.net/crypto-disclosures/"", ""https://storage.courtlistener.com/recap/gov.uscourts.dcd.256060/gov.uscourts.dcd.256060.1.0.pdf"", ""https://www.web3isgoinggreat.com/?id=cftc-sues-binance-and-ceo-changpeng-zhao""]",https://primary-cdn.web3isgoinggreat.com/entryImages/logos/resized/binance_300.webp,https://www.web3isgoinggreat.com/?id=sec-files-complaint-against-binance,2026-07-22 20:31:55
2022-06-08,Osmosis chain halted after bug leads to $5 million loss,Bug,,Cosmos,[],DeFi,"The Osmosis chain was halted on June 8 after users discovered a bug where people could deposit money into Osmosis pools and receive 3x the amount when they withdrew. The bug was first reported in a public Reddit post where a user posted, ""Bug on Osmosis There is a serious problem with osmosis. If you add liquidity to a pool and then remove it, it grows by 50%! How can we fix this!?!? Pools empty by morning!"" Developers halted the chain before liquidity pools were fully drained, but estimated that about $5 million was lost. They wrote that they were working on recovery plan; perhaps they will also encourage their community to report bugs privately, rather than via public Reddit post.","[""https://twitter.com/web3isgreat/status/1534609570634645509"", ""https://www.vice.com/en/article/m7gq5q/blockchain-decentralized-exchange-taken-offline-after-hacker-steals-millions""]",https://primary-cdn.web3isgoinggreat.com/entryImages/logos/resized/osmosis_300.webp,https://www.web3isgoinggreat.com/?id=osmosis-chain-halted-after-bug-leads-to-5-million-loss,2026-07-22 20:31:55
2022-05-04,Juno accidentally transfers $36 million in seized funds to inaccessible wallet address,Bummer,,Cosmos,[],DAO,"A protracted discussion and two different votes ended with the Juno project deciding to confiscate all but 50,000 of the 3 million $JUNO accumulated by one individual. When the discussions began, the 2.95 million $JUNO to be confiscated were worth a combined $121 million. However, the $JUNO price has dropped from the then all-time-high of around $40 to under $13, putting the value of the tokens to be confiscated closer to $38 million. Juno intended to transfer the seized tokens from the individual whale's wallet to a community-controlled wallet. However, the person making the transfer accidentally copied and pasted the wrong value, resulting in the funds being sent to a wallet address that no one can access — effectively burning the tokens. Daniel Hwang, who helps run one of the Juno validators, said to CoinDesk , ""We fucked up big time"". He also offered an unusual opinion: "" Validators should have due diligenced for ourselves to actually check the code we're executing and running"". Shortly after the botched transaction, the Juno community began voting on a proposal to hard fork a second time to fix their mistake.","[""https://twitter.com/web3isgreat/status/1522366891481870336"", ""https://www.coindesk.com/tech/2022/05/05/typo-moves-36m-in-seized-juno-tokens-to-wrong-wallet/"", ""https://www.web3isgoinggreat.com/?id=juno-whale-threatens-to-sue-network-validators-if-community-confiscates-his-tokens""]",https://primary-cdn.web3isgoinggreat.com/entryImages/logos/resized/juno_300.webp,https://www.web3isgoinggreat.com/?id=juno-accidentally-transfers-36-million-in-seized-funds-to-inaccessible-wallet-address,2026-07-22 20:31:55
2022-05-04,Attacker compromises MM.Finance to redirect $2 million in crypto assets to their own wallet,Hack or scam,DNS Hijacking,"Cosmos, Ethereum",[1],DeFi,"MM.Finance, a group of crypto projects based on the Cronos blockchain, suffered an attack that allowed a hacker to redirect more than $2 million worth of crypto assets that were being exchanged through the project's website to their own wallet. Although MM.Finance described the attack as "" DNS hijacking "", it seems unlikely this is an accurate description of the attack, which seems more likely to involve phished credentials to their domain service providers. ""Please do not perform any transactions or your funds will be sent to the exploiter wallet,"" MM.Finance tweeted shortly before taking the website offline. Three days earlier, MM.Finance had published a blog post to address "" FUD "" in their ecosystem stemming from a popular Reddit post that described MMF as an ""inverse pyramid of derivatives"" that the author believed would ""topple"", and outlined the project's ""rosy future"". The project promised to try to compensate users, with its developers foregoing 45 days of trading fees to reimburse users. They also appealed to the OKC crypto exchange to intervene to help recover funds from someone they believed to be the attacker, and threatened the attacker with the FBI. ""With all these information, we have more than what we need to bring this information to the FBI,"" they wrote on Twitter. ""So here's the deal, return 90% of the funds you stole and we will let this go, no questions asked. You have 48 hours to return these funds.""","[""https://twitter.com/web3isgreat/status/1522239813990162433"", ""https://en.wikipedia.org/wiki/DNS_hijacking"", ""https://twitter.com/MMFcrypto/status/1521943206333542401"", ""https://medium.com/@MMFinance/mm-finance-the-road-ahead-d67718791c13"", ""https://www.reddit.com/r/MMFinance/comments/uf8s30/personal_take_on_events_and_existing_tokenomics/"", ""https://medium.com/@MMFinance/dns-hi-jacking-post-mortem-compensation-3e2b5bb21183""]",https://primary-cdn.web3isgoinggreat.com/entryImages/logos/resized/mmfinance_300.webp,https://www.web3isgoinggreat.com/?id=mmfinance-suffers-apparent-frontend-breach,2026-07-22 20:31:55
2022-05-01,Juno whale threatens to sue network validators if community confiscates his tokens,Hmm,,Cosmos,[],DAO,"The Juno community has officially voted to confiscate over 2.95 million $JUNO owned by one whale who they believe gamed the airdrop to obtain more than his fair share. This follows a long community discussion about his actions, and formalized a previous community poll on what to do. When the discussions began, the 2.95 million $JUNO to potentially be confiscated were worth a combined $121 million. However, the $JUNO price has dropped from the then all-time-high of around $40 to $11.30, putting the value of the tokens to be confiscated closer to $33 million. The whale has repeatedly appealed to the community not to revoke his tokens, even trying to claim that the Juno developers had been secretly selling off $JUNO and damaging the community. Unfortunately for him, he didn't succeed in swaying the community, who voted on April 29 to confiscate his tokens. The whale has threatened to take ""legal action against each validator "" if the community burns or locks the tokens that previously belonged to him, and which he claims to have been managing on behalf of clients in an investment scheme.","[""https://twitter.com/web3isgreat/status/1520824099525824512"", ""https://www.coindesk.com/layer2/2022/04/29/juno-blockchain-community-officially-votes-to-revoke-whales-tokens/"", ""https://www.web3isgoinggreat.com/?id=juno-community-votes-to-take-community-members-tokens""]",https://primary-cdn.web3isgoinggreat.com/entryImages/logos/resized/juno_300.webp,https://www.web3isgoinggreat.com/?id=juno-whale-threatens-to-sue-network-validators-if-community-confiscates-his-tokens,2026-07-22 20:31:55
2022-03-10,"After someone games the system to acquire a disproportionate amount of airdropped tokens valued at $123 million, Juno community begins a vote to take them away",Hmm,,Cosmos,[],DAO,"A blockchain protocol called Juno launched in October 2021, airdropping their $JUNO tokens to members of the Cosmos ecosystem in proportion to how many $ATOM tokens they held. The protocol agreed via community vote that they would cap the amount given to a single individual at 50,000 $JUNO to ""ensure fair distribution across the network"". However, there is no restriction that one individual only have one crypto wallet, and so one single whale ended up receiving more than 3.1 million $JUNO across tens of wallets, which they later consolidated into one. Because of the enormous value centralized in one wallet — equivalent to around $123 million — if the whale sold off their $JUNO they could wipe out liquidity on decentralized exchanges and tank the price of the token. They could also perform a 51% attack on the network, as they already have half of quorum. On March 10, a community proposal was submitted, proposing to take away the majority of the whale's tokens (worth around $121 million), and leave them with the 50,000 $JUNO (a little below $2 million) that was originally intended to be the maximum per person. The vote passed, in a major blow to an ecosystem where ""your keys, your coins"" is taken as gospel — that is, if you control the keys to a wallet, your assets supposedly can't be taken from you.","[""https://twitter.com/web3isgreat/status/1502545102333521923"", ""https://www.coindesk.com/layer2/2022/03/11/juno-prop-16-we-can-vote-away-your-money-for-free/"", ""https://blockworks.co/juno-network-stakeholders-to-decide-fate-of-whales-millions-in-a-crypto-first/"", ""https://gateway.ipfs.io/ipfs/Qmf3bGHiSiPTTNohNv4tBn5rvTChoQZNp8UDbGMxPq9HYC#Correcting-the-gamed-stakedrop---Proposed-by-Core-1-after-numerous-discussions-with-the-community"", ""https://www.mintscan.io/juno/account/juno1aeh8gqu9wr4u8ev6edlgfq03rcy6v5twfn0ja8"", ""https://twitter.com/TheJunonaut/status/1501957393977995267"", ""https://www.web3isgoinggreat.com/?id=Correcting-the-gamed-stakedrop---Proposed-by-Core-1-after-numerous-discussions-with-the-community""]",https://primary-cdn.web3isgoinggreat.com/entryImages/logos/resized/juno_300.webp,https://www.web3isgoinggreat.com/?id=juno-community-votes-to-take-community-members-tokens,2026-07-22 20:31:55
